เล็กแห้งต้มยำ,เล็กแห้งต้มยำ
บะหมี่แห้งไม่กระเทียมเพิ่มเกี้ยว,บะหมี่แห้งไม่กระเทียมเพิ่มเกี้ยว
หมี่ขาวน้ำตกไม่ผักเปลี่ยนลูกชิ้นเป็นตับ,หมี่ขาวน้ำตกไม่ผักเปลี่ยนลูกชิ้นเป็นตับ
วุ้นเส้นน้ำตกไม่ผัก,วุ้นเส้นน้ำตกไม่ผัก
หมี่ขาวน้ำตกไม่ผักไม่ตับ,หมี่ขาวน้ำตกไม่ผักไม่ตับ
วุ้นเส้นน้ำตกต้มยำไม่ผัก,วุ้นเส้นน้ำตกต้มยำไม่ผัก
บะหมี่น้ำตกไม่ผักไม่กะเทียม,บะหมี่น้ำตกไม่ผักไม่กะเทียม
เล็กน้ำตก,เล็กน้ำตก
บะหมี่น้ำตก,บะหมี่น้ำตก
เล็กตกไม่ผัก,เล็กตกไม่ผัก
วุ้นเส้นน้ำตกไม่ผัก,วุ้นเส้นน้ำตกไม่ผัก
วุ้นเส้นตก,วุ้นเส้นตก
เล็กแห้งพิเศษไม่ผัก,เล็กแห้งพิเศษไม่ผัก
เล็กแห้งพิเศษ,เล็กแห้งพิเศษ
เล็กหมูน้ำตกไม่ใส่ถั่วงอก,เล็กหมูน้ำตกไม่ใส่ถั่วงอก
เล็กไก่ตุ๋นต้มยำไม่ผักไม่กระเทียม,เล็กไก่ตุ๋นต้มยำไม่ผักไม่กระเทียม
วุ้นเส้นน้ำตกไม่ถั่วงอก,วุ้นเส้นน้ำตกไม่ถั่วงอก
หมี่ขาวแห้งต้มยำไม่ผัก,หมี่ขาวแห้งต้มยำไม่ผัก
บะหมี่ต้มยำ,บะหมี่ต้มยำ
เล็กต้มยำไม่งอก,เล็กต้มยำไม่งอก
หมี่เหลืองต้มยำหมู,หมี่เหลืองต้มยำหมู
มาม่าต้มยำ,มาม่าต้มยำ
เล็กเนื้อน้ำตก,เล็กเนื้อน้ำตก
เล็กต้มยำพิเศษ,เล็กต้มยำพิเศษ
หมี่ขาวต้มยำ,หมี่ขาวต้มยำ
บะหมี่น้ำใส,บะหมี่น้ำใส
เล็กน้ำใส,เล็กน้ำใส
เล็กน้ำใสไม่ผัก,เล็กน้ำใสไม่ผัก
เล็กน้ำใสไม่งอก,เล็กน้ำใสไม่งอก
เล็กน้ำใสไม่ใส่กระเทียม,เล็กน้ำใสไม่ใส่กระเทียม
เล็กน้ำใสไม่ใส่ตับ,เล็กน้ำใสไม่ใส่ตับ
เล็กน้ำใสไม่ใส่ลูกชิ้น,เล็กน้ำใสไม่ใส่ลูกชิ้น
เล็กน้ำใสพิเศษ,เล็กน้ำใสพิเศษ
เล็กน้ำใสพิเศษไม่ผัก,เล็กน้ำใสพิเศษไม่ผัก
เล็กเนื้อน้ำตก,เล็กเนื้อน้ำตก
เล็กเนื้อน้ำใส,เล็กเนื้อน้ำใส
เล็กเนื้อน้ำใสพิเศษ,เล็กเนื้อน้ำใสพิเศษ
เล็กน้ำใสพิเศษไม่ใส่ถั่วงอก,เล็กน้ำใสพิเศษไม่ใส่ถั่วงอก
เล็กน้ำตกพิเศษไม่ใส่ถั่วงอก,เล็กน้ำตกพิเศษไม่ใส่ถั่วงอก
เล็กเนื้อน้ำตกพิเศษไม่ใส่ถั่วงอก,เล็กเนื้อน้ำตกพิเศษไม่ใส่ถั่วงอก
บะหมี่เนื้อน้ำตก,บะหมี่เนื้อน้ำตก
บะหมี่เนื้อน้ำตกพิเศษ,บะหมี่เนื้อน้ำตกพิเศษ
วุ้นเส้นต้มยำไม่ผัก,วุ้นเส้นต้มยำไม่ผัก
วุ้นเส้นต้มยำไม่ผักพิเศษ,วุ้นเส้นต้มยำไม่ผักพิเศษ
มาม่าน้ำตก,มาม่าน้ำตก
มาม่าต้มยำไม่งอก,มาม่าต้มยำไม่งอก
มาม่าแห้งต้มยำไม่ผัก,มาม่าแห้งต้มยำไม่ผัก
เล็กแห้งพิเศษไม่ผัก,เล็กแห้งพิเศษไม่ผัก
บะหมี่น้ำใสไม่กระเทียม,บะหมี่น้ำใสไม่กระเทียม
หมี่ขาวน้ำใส,หมี่ขาวน้ำใส
เล็กต้มยำ,เล็กต้มยำ
เล็กต้มยำไม่กระเทียม,เล็กต้มยำไม่กระเทียม
เล็กต้มยำไม่ผัก,เล็กต้มยำไม่ผัก
เล็กต้มยำไม่ผักไม่กระเทียม,เล็กต้มยำไม่ผักไม่กระเทียม
เล็กต้มยำไม่งอก,เล็กต้มยำไม่งอก
เล็กน้ำใสไม่ใส่ถั่วงอก,เล็กน้ำใสไม่ใส่ถั่วงอก
วุ้นเส้นน้ำใส,วุ้นเส้นน้ำใส
วุ้นเส้นน้ำใสไม่ผัก,วุ้นเส้นน้ำใสไม่ผัก
วุ้นเส้นน้ำใสพิเศษ,วุ้นเส้นน้ำใสพิเศษ
วุ้นเส้นน้ำใสไม่ใส่กระเทียม,วุ้นเส้นน้ำใสไม่ใส่กระเทียม
วุ้นเส้นน้ำใสพิเศษไม่ผัก,วุ้นเส้นน้ำใสพิเศษไม่ผัก
เส้นเล็กน้ำตกไม่งอกไม่กระเทียมพิเศษ,เส้นเล็กน้ำตกไม่งอกไม่กระเทียมพิเศษ
มาม่าต้มยำไม่งอกเพิ่มเกี้ยว,มาม่าต้มยำไม่งอกเพิ่มเกี้ยว
หมี่ขาวน้ำตกไม่ผักพิเศษเพิ่มเนื้อ,หมี่ขาวน้ำตกไม่ผักพิเศษเพิ่มเนื้อ
หมี่ขาวน้ำตกพิเศษไม่ผัก,หมี่ขาวน้ำตกพิเศษไม่ผัก
หมี่ขาวต้มยำพิเศษ,หมี่ขาวต้มยำพิเศษ
หมี่เหลืองต้มยำ,หมี่เหลืองต้มยำ
หมี่เหลืองต้มยำไม่ผัก,หมี่เหลืองต้มยำไม่ผัก
หมี่เหลืองแห้งพิเศษไม่ผัก,หมี่เหลืองแห้งพิเศษไม่ผัก
หมี่เหลืองน้ำใสไม่ผักไม่กระเทียม,หมี่เหลืองน้ำใสไม่ผักไม่กระเทียม
หมี่เหลืองน้ำใสไม่ผัก,หมี่เหลืองน้ำใสไม่ผัก
หมี่เหลืองต้มยำไม่ผัก,หมี่เหลืองต้มยำไม่ผัก
หมี่เหลืองน้ำตกไม่ผัก,หมี่เหลืองน้ำตกไม่ผัก
หมี่เหลืองน้ำตกพิเศษไม่ผัก,หมี่เหลืองน้ำตกพิเศษไม่ผัก
มาม่าน้ำตกพิเศษ,มาม่าน้ำตกพิเศษ
มาม่าน้ำตกพิเศษไม่ผัก,มาม่าน้ำตกพิเศษไม่ผัก
มาม่าต้มยำพิเศษ,มาม่าต้มยำพิเศษ
มาม่าน้ำตก,มาม่าน้ำตก
หมี่เหลืองน้ำตก,หมี่เหลืองน้ำตก
วุ้นเส้นน้ำตก,วุ้นเส้นน้ำตก
หมี่ขาวน้ำตกเพิ่มเกี้ยว,หมี่ขาวน้ำตกเพิ่มเกี้ยว
เส้นหมี่น้ำใสไม่ใส่ถั่วงอก,เส้นหมี่น้ำใสไม่ใส่ถั่วงอก
บะหมี่ต้มยำพิเศษ,บะหมี่ต้มยำพิเศษ
บะหมี่น้ำใส,บะหมี่น้ำใส
วุ้นเส้นน้ำใส,วุ้นเส้นน้ำใส
มาม่าน้ำใส,มาม่าน้ำใส
หมี่ขาวน้ำใส,หมี่ขาวน้ำใส
เส้นเล็กน้ำใส,เส้นเล็กน้ำใส
เล็กแห้ง,เล็กแห้ง
หมี่เหลืองแห้ง,หมี่เหลืองแห้ง
บะหมี่แห้ง,บะหมี่แห้ง
มาม่าแห้ง,มาม่าแห้ง
วุ้นเส้นแห้ง,วุ้นเส้นแห้ง
หมี่ขาวแห้ง,หมี่ขาวแห้ง
วุ้นเส้นต้มยำ,วุ้นเส้นต้มยำ
วุ้นเส้นต้มยำพิเศษ,วุ้นเส้นต้มยำพิเศษ
เล็กน้ำใสไม่งอกไม่กระเทียม,เล็กน้ำใสไม่งอกไม่กระเทียม
เล็กแห้งไม่ใส่ถั่วงอก,เล็กแห้งไม่ใส่ถั่วงอก
เล็กแห้งพิเศษไม่ใส่กระเทียมเจียว,เล็กแห้งพิเศษไม่ใส่กระเทียมเจียว
หมี่เหลืองน้ำตกพิเศษ,หมี่เหลืองน้ำตกพิเศษ
วุ้นเส้นต้มยำพิเศษไม่ใส่ผัก,วุ้นเส้นต้มยำพิเศษไม่ใส่ผัก